[
  {
    "edge_id": "77777777-7777-7777-7777-777777777777",
    "source": "frontend",
    "target": "payments-api",
    "edge_type": "runtime",
    "observed_at": "2026-06-17T12:00:00Z",
    "confidence": 0.95,
    "allowed": true
  },
  {
    "edge_id": "88888888-8888-8888-8888-888888888888",
    "source": "frontend",
    "target": "database",
    "edge_type": "runtime",
    "observed_at": "2026-06-17T12:00:00Z",
    "confidence": 0.9,
    "allowed": false
  },
  {
    "edge_id": "99999999-9999-9999-9999-999999999999",
    "source": "analytics",
    "target": "database",
    "edge_type": "runtime",
    "observed_at": "2026-06-17T12:00:00Z",
    "confidence": 0.8,
    "allowed": true
  },
  {
    "edge_id": "eeeeeeee-eeee-eeee-eeee-eeeeeeeeeeee",
    "source": "brand-new-service",
    "target": "unknown-target",
    "edge_type": "runtime",
    "observed_at": "2026-06-17T12:00:00Z",
    "confidence": 0.6,
    "allowed": true
  }
]
